source_object,source_outlet,destination_object,destination_inlet,description,is_recommended,audio_signal_flow,performance_impact,compatibility_issues,connection_type,latency_impact,vector_size_dependency,feedback_safe
buffer~,0,groove~,0,高度なサンプル再生のためのバッファ参照,1,0,中程度,バッファサイズに依存,Buffer Reference,なし,なし,1.0
mc.pack~,0,pfft~,0,マルチチャンネル信号のスペクトル処理,1,1,非常に高い,チャンネル数の対応が必要,Multichannel to FFT,FFTサイズに依存,FFTサイズに依存,1.0
adc~,0,multiband_split~,0,入力信号のマルチバンド分割,1,1,高い,なし,Multiband Processing,最小限,なし,1.0
multiband_split~,0,poly~,0,マルチバンド分割されたバンドごとの処理,1,1,非常に高い,なし,Band Processing,最小限,なし,1.0
poly~,0,matrix~,0,複数のポリフォニックボイスからマトリックスミキシング,1,1,高い,なし,Voice Mixing,最小限,なし,1.0
gizmo~,0,poly~,0,ピッチシフトからポリフォニック処理へ,1,1,高い,なし,Pitch Processing,中程度,なし,1.0
pfft~,0,vectral~,0,スペクトル処理からベクトル化処理へ,1,1,非常に高い,なし,Advanced Spectral Processing,高い,FFTサイズに依存,1.0
fft.frame~,0,ml.svm,0,スペクトル特徴量から機械学習分類へ,1,0,非常に高い,データフォーマットの変換が必要,Audio to ML,分析ウィンドウサイズに依存,なし,1.0
